{
  "tosa_file": "test_add_1x4x4x4_f32.tosa",
  "ifm_name": [
    "InputTensor-tf0",
    "InputTensor-tf1"
  ],
  "ifm_file": [
    "../placeholder_0.npy",
    "../placeholder_1.npy"
  ],
  "ofm_name": [
    "Result0"
  ],
  "ofm_file": [
    "ref_model_Result0.npy"
  ],
  "expected_failure": false
}